{"assumptions":[],"claim_id":"claim.phase3b.meaning","declaration_name":"AdaIvyMeaning","imports":[],"meaning_tests":[{"proof_fragment":"by exact True.intro","statement":"False","test_id":"counterexample.boundary"}],"proof_fragment":"by rfl","request_id":"request.phase3b.meaning","schema_version":"1.0.0","semantic_alignment_id":"alignment.phase3b.meaning.proposed","source_kind":"operator","target_statement":"(n : Nat) : n = n"}
