{"assumptions":[],"claim_id":"claim.phase3b.timeout","declaration_name":"AdaIvyTimeout","imports":[],"meaning_tests":[],"proof_fragment":"by rfl","request_id":"request.phase3b.timeout","schema_version":"1.0.0","semantic_alignment_id":null,"source_kind":"operator","target_statement":"(n : Nat) : n = n"}
