{"assumptions":[{"name":"AdaIvyAssumptionP","type_expression":"Prop"},{"name":"AdaIvyAssumptionProof","type_expression":"AdaIvyAssumptionP"}],"claim_id":"claim.phase3b.axiom","declaration_name":"AdaIvyAxiom","imports":[],"meaning_tests":[],"proof_fragment":"by exact AdaIvyAssumptionProof","request_id":"request.phase3b.axiom","schema_version":"1.0.0","semantic_alignment_id":null,"source_kind":"external","target_statement":": AdaIvyAssumptionP"}
