{"assumptions":[],"claim_id":"claim.phase3b.placeholder","declaration_name":"AdaIvyPlaceholder","imports":[],"meaning_tests":[],"proof_fragment":"by sorry","request_id":"request.phase3b.placeholder","schema_version":"1.0.0","semantic_alignment_id":null,"source_kind":"model","target_statement":"True"}
